Designator,Footprint,Quantity,Value,LCSC Part #
"D1, D19, D2, D20, D21, D22, D23, D24, D3, D37, D38, D39, D4, D40, D41, D42, D5, D55, D56, D57, D58, D59, D6, D60, D79, D80, D81, D82, D83, D84",603,30,BLUE,C72041
"D10, D11, D12, D25, D26, D27, D28, D29, D30, D43, D44, D45, D46, D47, D48, D61, D62, D63, D64, D65, D66, D7, D8, D85, D86, D87, D88, D89, D9, D90",603,30,RED,C2286
"D13, D14, D15, D16, D17, D18, D31, D32, D33, D34, D35, D36, D49, D50, D51, D52, D53, D54, D67, D68, D69, D70, D71, D72, D73, D74, D75, D76, D77, D78",603,30,WHITE,C2290
"Q1, Q10, Q11, Q12, Q13, Q14, Q15, Q2, Q3, Q4, Q5, Q6, Q7, Q8, Q9",SOT-23,15,2N7002,C8545
"R1, R2, R22, R23, R24, R25, R26, R27, R3, R4, R43, R44, R45, R46, R47, R48, R5, R6, R64, R65, R66, R67, R68, R69, R92, R93, R94, R95, R96, R97",603,30,390,C23151
"R10, R100, R101, R102, R103, R11, R12, R28, R29, R30, R31, R32, R33, R49, R50, R51, R52, R53, R54, R7, R70, R71, R72, R73, R74, R75, R8, R9, R98, R99",603,30,150,C22808
"R104, R105, R13, R14, R15, R16, R17, R18, R19, R20, R21, R34, R35, R36, R37, R38, R39, R40, R41, R42, R55, R56, R57, R58, R59, R60, R61, R62, R63, R76, R77, R78, R79, R80, R81, R82, R83, R84, R85, R86, R87, R88, R89, R90, R91",603,45,100,C22775
